{
  "schemaVersion": 1,
  "project": {
    "name": "Acervo",
    "description": "Biblioteca de documentos · sistema ilustrativo",
    "version": "Modelo 01",
    "snapshot": "Contrato de exemplo",
    "scope": "Modelo ilustrativo. Não corresponde a uma aplicação ou a um ambiente de produção.",
    "theme": "paper",
    "language": "pt-BR"
  },
  "maps": [
    {
      "id": "context",
      "title": "O sistema em uma página",
      "section": "Arquitetura",
      "summary": "Uma biblioteca de documentos com duas jornadas: consultar arquivos autorizados e publicar conteúdo para processamento assíncrono.",
      "type": "architecture",
      "nodes": [
        {
          "id": "person",
          "label": "Pessoa usuária",
          "subtitle": "Consulta e publicação",
          "kind": "external",
          "description": "Acessa arquivos autorizados e acompanha o processamento dos próprios envios.",
          "status": "proposed",
          "evidence": [
            "D01"
          ]
        },
        {
          "id": "web",
          "label": "Aplicação web",
          "subtitle": "Interface do produto",
          "kind": "frontend",
          "description": "Apresenta biblioteca, busca, upload e acompanhamento dos jobs.",
          "status": "proposed",
          "evidence": [
            "D01"
          ]
        },
        {
          "id": "api",
          "label": "API de documentos",
          "subtitle": "Autorização e contratos",
          "kind": "backend",
          "description": "Valida sessão, aplica permissões e coordena leitura e publicação sem processar arquivos no request.",
          "status": "proposed",
          "evidence": [
            "D01"
          ]
        },
        {
          "id": "database",
          "label": "PostgreSQL",
          "subtitle": "Metadados e estado",
          "kind": "database",
          "description": "Persiste os registros do produto, o vínculo com o arquivo e o estado visível de processamento.",
          "status": "proposed",
          "evidence": [
            "D01"
          ]
        },
        {
          "id": "queue",
          "label": "Fila de processamento",
          "subtitle": "Jobs e tentativas",
          "kind": "messagebus",
          "description": "Separa a resposta HTTP do trabalho demorado. A proposta exige durabilidade e limites de repetição.",
          "status": "proposed",
          "evidence": [
            "D01"
          ]
        },
        {
          "id": "worker",
          "label": "Worker de documentos",
          "subtitle": "Extração e validação",
          "kind": "worker",
          "description": "Processa um arquivo por job e atualiza os metadados conforme o resultado.",
          "status": "proposed",
          "evidence": [
            "D01"
          ]
        },
        {
          "id": "storage",
          "label": "Armazenamento",
          "subtitle": "Arquivos originais",
          "kind": "cloud",
          "description": "Mantém os objetos binários fora do banco relacional; o acesso depende de autorização.",
          "status": "proposed",
          "evidence": [
            "D01"
          ]
        }
      ],
      "edges": [
        {
          "id": "access",
          "from": "person",
          "to": "web",
          "label": "acesso",
          "variant": "default",
          "status": "proposed",
          "evidence": [
            "D01"
          ]
        },
        {
          "id": "request",
          "from": "web",
          "to": "api",
          "label": "HTTPS",
          "variant": "default",
          "status": "proposed",
          "evidence": [
            "D01"
          ]
        },
        {
          "id": "read",
          "from": "api",
          "to": "database",
          "label": "consulta",
          "variant": "default",
          "status": "proposed",
          "evidence": [
            "D01"
          ]
        },
        {
          "id": "job",
          "from": "api",
          "to": "queue",
          "label": "publica job",
          "variant": "default",
          "status": "proposed",
          "evidence": [
            "D01"
          ]
        },
        {
          "id": "consume",
          "from": "queue",
          "to": "worker",
          "label": "entrega",
          "variant": "default",
          "status": "proposed",
          "evidence": [
            "D01"
          ]
        },
        {
          "id": "persist",
          "from": "worker",
          "to": "database",
          "label": "resultado",
          "variant": "emphasis",
          "status": "proposed",
          "evidence": [
            "D01"
          ]
        },
        {
          "id": "file",
          "from": "worker",
          "to": "storage",
          "label": "arquivo",
          "variant": "default",
          "status": "proposed",
          "evidence": [
            "D01"
          ]
        },
        {
          "id": "download",
          "from": "api",
          "to": "storage",
          "label": "acesso autorizado",
          "variant": "default",
          "status": "proposed",
          "evidence": [
            "D01"
          ]
        }
      ],
      "steps": [
        {
          "title": "A pessoa entra pela interface",
          "description": "A API é a fronteira de autorização.",
          "nodes": [
            "person",
            "web",
            "api"
          ],
          "edges": [
            "access",
            "request"
          ]
        },
        {
          "title": "A publicação vira um job",
          "description": "A fila desacopla o processamento.",
          "nodes": [
            "api",
            "queue",
            "worker"
          ],
          "edges": [
            "job",
            "consume"
          ]
        },
        {
          "title": "O resultado fica disponível",
          "description": "Metadados e arquivos têm papéis separados.",
          "nodes": [
            "worker",
            "database",
            "storage"
          ],
          "edges": [
            "persist",
            "file"
          ]
        }
      ],
      "notes": [
        {
          "title": "Dois tipos de dado, dois destinos",
          "text": "O banco mantém estado e metadados. O armazenamento de objetos mantém o arquivo original. Uma referência não substitui o objeto."
        },
        {
          "title": "Limite desta vista",
          "text": "O fluxo é uma proposta ilustrativa. A implementação real deve definir autenticação, consistência, repetição e políticas de retenção."
        }
      ]
    },
    {
      "id": "upload",
      "title": "Publicar um documento",
      "section": "Processos",
      "summary": "A jornada de publicação começa com validação e termina com um resultado consultável. Falhas precisam ter tratamento explícito.",
      "type": "workflow",
      "direction": "TB",
      "nodes": [
        {
          "id": "upload",
          "label": "Receber upload",
          "subtitle": "Entrada autenticada",
          "kind": "frontend",
          "description": "Recebe o envio e identifica a pessoa responsável.",
          "status": "proposed",
          "evidence": [
            "D01"
          ]
        },
        {
          "id": "validate",
          "label": "Validar arquivo",
          "subtitle": "Tipo, tamanho e acesso",
          "kind": "security",
          "description": "Rejeita conteúdo não suportado e acessos sem permissão.",
          "status": "proposed",
          "evidence": [
            "D01"
          ]
        },
        {
          "id": "enqueue",
          "label": "Registrar processamento",
          "subtitle": "Job durável",
          "kind": "messagebus",
          "description": "Registra o identificador do job e responde sem aguardar a extração.",
          "status": "proposed",
          "evidence": [
            "D01"
          ]
        },
        {
          "id": "extract",
          "label": "Processar documento",
          "subtitle": "Extração e consistência",
          "kind": "worker",
          "description": "Extrai conteúdo, verifica integridade e aplica os limites de execução.",
          "status": "proposed",
          "evidence": [
            "D01"
          ]
        },
        {
          "id": "complete",
          "label": "Publicar resultado",
          "subtitle": "Estado concluído",
          "kind": "database",
          "description": "Persiste o resultado e disponibiliza a consulta autorizada.",
          "status": "proposed",
          "evidence": [
            "D01"
          ]
        },
        {
          "id": "fail",
          "label": "Registrar falha",
          "subtitle": "Diagnóstico e suporte",
          "kind": "state",
          "description": "Distingue falha definitiva de tentativa recuperável.",
          "status": "proposed",
          "evidence": [
            "D01"
          ]
        }
      ],
      "edges": [
        {
          "id": "u1",
          "from": "upload",
          "to": "validate",
          "label": "arquivo",
          "variant": "default",
          "status": "proposed",
          "evidence": [
            "D01"
          ]
        },
        {
          "id": "u2",
          "from": "validate",
          "to": "enqueue",
          "label": "aceito",
          "variant": "default",
          "status": "proposed",
          "evidence": [
            "D01"
          ]
        },
        {
          "id": "u3",
          "from": "enqueue",
          "to": "extract",
          "label": "job",
          "variant": "default",
          "status": "proposed",
          "evidence": [
            "D01"
          ]
        },
        {
          "id": "u4",
          "from": "extract",
          "to": "complete",
          "label": "sucesso",
          "variant": "emphasis",
          "status": "proposed",
          "evidence": [
            "D01"
          ]
        },
        {
          "id": "u5",